{
  "schemaVersion": 1,
  "releaseId": "simcore-v0.69.1-new-06",
  "product": "SimCore",
  "version": "0.69.1",
  "releaseName": "Refreshless Targeted Update Liveness Repair",
  "releaseMode": "NEW_VERSION",
  "candidateCommit": "5dc5ec1099c6097a6a0e46effeb826889a4741c3",
  "expectedProductionCommit": "31b4c5075659a55861731c6fd73f999402321e94",
  "candidateReleaseBlob": "de764f2c98174aa7f8ae8dc356d83aa6851b3745",
  "primaryGoalId": "06901_REFRESHLESS_TARGETED_UPDATE_LIVENESS_REPAIR",
  "changeClass": "RUNTIME_CORRECTION",
  "evidenceRefs": [
    "docs/SIMCORE_06901_REFRESHLESS_TARGETED_UPDATE_LIVENESS_REPAIR_DESIGN_2026-08-30.md",
    "docs/SIMCORE_06901_IMPLEMENTATION_AUTHORIZATION_2026-08-30.md",
    "docs/SIMCORE_06901_IMPLEMENTATION_PREFLIGHT_2026-08-30.md",
    "docs/SIMCORE_06901_IMPLEMENTATION_EVIDENCE_2026-08-30.md",
    "docs/SIMCORE_06901_CANDIDATE_CI_FAILURE_01_RELOAD_VERSION_BRIDGE_2026-08-30.md",
    "docs/SIMCORE_06901_CANDIDATE_CI_FAILURE_02_RELOAD_CONTRACT_TRANSITION_2026-08-30.md",
    "docs/SIMCORE_06901_CANDIDATE_CI_FAILURE_03_OPERATOR_CARD_VERSION_BRIDGE_2026-08-30.md",
    "docs/SIMCORE_06901_CANDIDATE_CI_FAILURE_04_HOST_LOCAL_TELEMETRY_VERSION_BRIDGE_2026-08-30.md",
    "docs/SIMCORE_06901_CANDIDATE_CI_FAILURE_05_BOUNDED_TELEMETRY_VERSION_BRIDGE_2026-08-30.md"
  ],
  "liveGate": {
    "required": true,
    "scenarioId": "06901_REFRESHLESS_TARGETED_UPDATE_LIVENESS_REAL_LONG_CHAT",
    "closeAuthority": "HUMAN_EVIDENCE"
  }
}
