{
  "schemaVersion": 1,
  "releaseId": "simcore-v0.64.10-new-05",
  "product": "SimCore",
  "version": "0.64.10",
  "releaseName": "Host-Local One-Shot Telemetry Handoff",
  "releaseMode": "NEW_VERSION",
  "candidateCommit": "e43ace74241984f21f69299eff690d0c4f483381",
  "expectedProductionCommit": "1c1037e44d6b3e903b3d622b579095b1f315758e",
  "candidateReleaseBlob": "b7d76bd03a435356eeea6948968b0d33ac564ae7",
  "primaryGoalId": "06410_HOST_LOCAL_ONE_SHOT_TELEMETRY_HANDOFF",
  "changeClass": "RUNTIME_CORRECTION",
  "evidenceRefs": [
    "docs/SIMCORE_06410_HOST_LOCAL_ONE_SHOT_TELEMETRY_HANDOFF_ACTIVATION.md",
    "docs/SIMCORE_LIVE_06409_SESSION_ACCESS_ERROR_2026-08-28.md",
    "docs/SIMCORE_06410_HOST_LOCAL_ONE_SHOT_TELEMETRY_HANDOFF_IMPLEMENTATION_EVIDENCE.md"
  ],
  "liveGate": {
    "required": true,
    "scenarioId": "06410_HOST_LOCAL_RELOAD_CONTINUITY_REAL_LONG_CHAT",
    "closeAuthority": "HUMAN_EVIDENCE"
  }
}
