{
  "schemaVersion": 1,
  "releaseId": "simcore-v0.66.0-new-02",
  "product": "SimCore",
  "version": "0.66.0",
  "releaseName": "M2-4 Session / Runtime Mirror Boundary Completion",
  "releaseMode": "NEW_VERSION",
  "candidateCommit": "ea88eecb4428a42682894c96980bef420b0a0d27",
  "expectedProductionCommit": "c6659296c68b4322d0ed43f7d8a3339e57f1cbf1",
  "candidateReleaseBlob": "766c3b758ca26ae72546a38bfa1c053efa666c45",
  "primaryGoalId": "06600_M2_4_SESSION_RUNTIME_MIRROR_BOUNDARY_COMPLETION",
  "changeClass": "RUNTIME_FEATURE",
  "evidenceRefs": [
    "docs/SIMCORE_06600_M2_4_SESSION_RUNTIME_MIRROR_BOUNDARY_COMPLETION_ACTIVATION.md",
    "docs/SIMCORE_06600_M2_4_IMPLEMENTATION_EVIDENCE.md",
    "docs/SIMCORE_06600_ARCH_CONTRACT_POST_06500_PROMOTION_DRIFT_2026-08-29.md",
    "docs/SIMCORE_06600_RELEASE_INTENT_FAILURE_01_VERSIONED_REGRESSION_BRIDGES_2026-08-29.md",
    "docs/SIMCORE_06600_BUILDER_VALIDATION_FAILURE_01_SLICE_B_ASSERTION_2026-08-29.md",
    "docs/SIMCORE_06600_BUILDER_VALIDATION_HARNESS_FAILURE_02_SELF_DELETE_STAGE_2026-08-29.md",
    "docs/SIMCORE_06600_BUILDER_VALIDATION_HARNESS_FAILURE_03_WORKFLOW_PERMISSION_2026-08-29.md",
    "docs/SIMCORE_06600_BUILDER_VALIDATION_HARNESS_FAILURE_04_PYCOMPILE_BYTECODE_2026-08-29.md",
    "docs/SIMCORE_06600_BRANCH_HYGIENE_AND_DRAFT_PR_FAILURE_05_2026-08-29.md"
  ],
  "liveGate": {
    "required": true,
    "scenarioId": "06600_M2_4_SESSION_RUNTIME_MIRROR_BOUNDARY_COMPLETION_REAL_LONG_CHAT",
    "closeAuthority": "HUMAN_EVIDENCE"
  }
}
