{
  "schemaVersion": 1,
  "releaseId": "simcore-v0.70.3-new-13",
  "product": "SimCore",
  "version": "0.70.3",
  "releaseName": "Post-M2 Simplification Convergence",
  "releaseMode": "NEW_VERSION",
  "candidateCommit": "cd36dcdc59d019d41913b9991cabc89ba4663a9a",
  "expectedProductionCommit": "861100f4771967aa5b8ab8811d06f11702c0d3ff",
  "candidateReleaseBlob": "068df0d6b792b2878c0c745949e0b9d38fc667fa",
  "primaryGoalId": "S7_POST_M2_SIMPLIFICATION_PROGRAM_CONVERGENCE",
  "changeClass": "RUNTIME_CORRECTION",
  "evidenceRefs": [
    "docs/SIMCORE_S7_POST_M2_SIMPLIFICATION_PROGRAM_CONVERGENCE_DESIGN_2026-08-31.md",
    "docs/SIMCORE_S6_PROMPT_COMMUNITY_SEMANTIC_RESTRAINT_CLOSURE_2026-08-31.md",
    "docs/SIMCORE_S5_1_STATE_RECONCILE_OPTIONAL_TRIMMED_STRING_CONVERGENCE_CLOSURE_2026-08-31.md",
    "docs/SIMCORE_S5_1_STATE_RECONCILE_OPTIONAL_TRIMMED_STRING_CONVERGENCE_IMPLEMENTATION_EVIDENCE_2026-08-31.md",
    "docs/SIMCORE_S7_POST_M2_SIMPLIFICATION_PROGRAM_CONVERGENCE_IMPLEMENTATION_EVIDENCE_2026-09-03.md",
    "docs/SIMCORE_CACHE_A2_EXACT_BYTE_ABI_FIXTURE_BASELINE_2026-09-03.md",
    "docs/SIMCORE_CACHE_A3_CANONICAL_EQUIVALENCE_SHADOW_DESCRIPTOR_2026-09-03.md",
    "docs/SIMCORE_07003_EXACT_APPROVAL_TRANSACTION_BLOCKER_2026-09-03.md"
  ],
  "liveGate": {
    "required": true,
    "scenarioId": "S7_CUMULATIVE_SIMPLIFICATION_REAL_LONG_CHAT",
    "closeAuthority": "HUMAN_EVIDENCE"
  }
}
