{
  "schemaVersion": 1,
  "releaseId": "simcore-v0.70.4-new-02",
  "product": "SimCore",
  "version": "0.70.4",
  "releaseName": "Manual Edit Rebuild Attribution",
  "releaseMode": "NEW_VERSION",
  "candidateCommit": "df282f18a0035b03be30af8d0ee2174f58b3bcd3",
  "expectedProductionCommit": "4c618563f43b8a3ff0eeb18eeff5536bb287369b",
  "candidateReleaseBlob": "7cf830bd6c48f706e97f116f019144bf280e301c",
  "primaryGoalId": "07004_MANUAL_EDIT_REBUILD_ATTRIBUTION",
  "changeClass": "RUNTIME_FEATURE",
  "evidenceRefs": [
    "docs/SIMCORE_07004_MANUAL_EDIT_REBUILD_ATTRIBUTION_DESIGN_2026-09-04.md",
    "docs/SIMCORE_LIVE_07003_S7_RELEASE_CLOSE_2026-09-04.md",
    "docs/SIMCORE_07004_IMPLEMENTATION_AUTHORIZATION_2026-09-04.md",
    "docs/SIMCORE_07004_IMPLEMENTATION_EVIDENCE_2026-09-04.md",
    "docs/SIMCORE_07004_IMPLEMENTATION_REGRESSION_FAILURE_01_COMMENT_MARKER_2026-09-04.md",
    "docs/SIMCORE_07004_IMPLEMENTATION_REGRESSION_FAILURE_02_REPRESENTATION_FAST_FIXTURE_2026-09-04.md",
    "docs/SIMCORE_07004_CANDIDATE_FAILURE_01_VALIDATION_PROFILE_GAP_2026-09-04.md",
    "docs/SIMCORE_07004_VALIDATION_PROFILE_REPAIR_EVIDENCE_2026-09-04.md",
    "docs/SIMCORE_07004_EXACT_APPROVAL_FAILURE_01_PACKAGE_INCOMPLETE_2026-09-04.md"
  ],
  "liveGate": {
    "required": true,
    "scenarioId": "07004_MANUAL_EDIT_REBUILD_ATTRIBUTION_REAL_LONG_CHAT",
    "closeAuthority": "HUMAN_EVIDENCE"
  }
}
